{
  "id": "valid-formatting",
  "result": {
    "canonicalHex": "7363726962652d636f6d70696c65722f302e317c7370656c6c7c656d6265725f626f6c747c0a7461726765745f7261797c343033303030303030303030303030300a64616d6167657c7461726765747c666972657c343031303030303030303030303030300a707573687c7461726765747c336665333333333333333333333333330a636f6f6c646f776e7c34303038303030303030303030303030",
    "compilerVersion": "scribe-compiler/0.1",
    "identitySha256": "98bcdabb793df300adb2a640d2171d235ec3d80b60d7cf27a04a868371df8440",
    "name": "ember_bolt",
    "operations": [
      {
        "damageType": null,
        "opcode": "target_ray",
        "target": null,
        "valueBits": "4030000000000000"
      },
      {
        "damageType": "fire",
        "opcode": "damage",
        "target": "target",
        "valueBits": "4010000000000000"
      },
      {
        "damageType": null,
        "opcode": "push",
        "target": "target",
        "valueBits": "3fe3333333333333"
      },
      {
        "damageType": null,
        "opcode": "cooldown",
        "target": null,
        "valueBits": "4008000000000000"
      }
    ],
    "status": "accepted"
  },
  "schemaVersion": 1,
  "source": "spell ember_bolt {target ray 16.0;damage target fire 4.00;push target 0.60;cooldown 3.0s;}\n"
}
