{
  "id": "valid-damage-types",
  "result": {
    "canonicalHex": "7363726962652d636f6d70696c65722f302e317c7370656c6c7c656c656d656e74737c0a64616d6167657c7461726765747c706879736963616c7c336666303030303030303030303030300a64616d6167657c7461726765747c666972657c343030303030303030303030303030300a64616d6167657c7461726765747c66726f73747c343030383030303030303030303030300a64616d6167657c7461726765747c617263616e657c34303130303030303030303030303030",
    "compilerVersion": "scribe-compiler/0.1",
    "identitySha256": "376991329b5e39e1170a182f1cfb5a3486b32e514b5991b703ed0a7c9e28a04a",
    "name": "elements",
    "operations": [
      {
        "damageType": "physical",
        "opcode": "damage",
        "target": "target",
        "valueBits": "3ff0000000000000"
      },
      {
        "damageType": "fire",
        "opcode": "damage",
        "target": "target",
        "valueBits": "4000000000000000"
      },
      {
        "damageType": "frost",
        "opcode": "damage",
        "target": "target",
        "valueBits": "4008000000000000"
      },
      {
        "damageType": "arcane",
        "opcode": "damage",
        "target": "target",
        "valueBits": "4010000000000000"
      }
    ],
    "status": "accepted"
  },
  "schemaVersion": 1,
  "source": "spell elements {\n  damage target physical 1;\n  damage target fire 2;\n  damage target frost 3;\n  damage target arcane 4;\n}\n"
}
